sentence,miti_code,augmented,source
"わ,わかりません。私が言いたいのは,息子の周りでは吸わないように気をつけているという事です。車の中では吸いませんし,息子が家にいるときは外に吸いに行きます。とにかく私にたばこが悪いというのは分かっているし,息子にとっても悪いタバコだと分かっているからタバコの周りにいないでほしいと言っているし,本当に気をつけています。[SEP]エイデンのためにもあなたの健康のためにもタバコをやめたほうがいいと思います。子どもの周りでタバコを吸うことが影響するのは耳の感染症だけではないのは知っていましたか?[SEP]うん",4,True,case3.csv
"わ,わかりません。私が言いたいのは,息子の周りでは吸わないように気をつけているというのです。車の中では吸いませんし,息子が家にいるときは外に吸いに行きます。とにかく私にたばこが悪いという事は分かっているし,息子にとっても悪いものだと分かっているからタバコの周りにいないでほしいと言っているし,本当に気をつけています。[SEP]エイデンのためにもあなたの健康のためにもタバコをやめたほうがいいと思います。子どもの周りでタバコを吸うことが影響するのは耳の感染症だけではないのは知っていましたか?[SEP]うん",4,True,case3.csv
"わ,わかりません。私が言いたいのは,息子の周りでは吸わないように気をつけているというものです。車の中では吸いませんし,息子が家にいるときは外に吸いに行きます。とにかく私にたばこが悪いという気持ちは分かっているし,息子にとっても悪いのだと分かっているからタバコの周りにいないでほしいと言っているし,本当に気をつけています。[SEP]エイデンのためにもあなたの健康のためにもタバコをやめたほうがいいと思います。子どもの周りでタバコを吸うことが影響するのは耳の感染症だけではないのは知っていましたか?[SEP]うん",4,True,case3.csv
わ，わかりません。私が言いたいのは，息子の周りでは吸わないように気をつけているということです。車の中では吸いませんし，息子が家にいるときは外に吸いに行きます。とにかく私にたばこが悪いということは分かっているし，息子にとっても悪いことだと分かっているからタバコの周りにいないでほしいと言っているし，本当に気をつけています。[SEP]エイデンのためにもあなたの健康のためにもタバコをやめたほうがいいと思います。子どもの周りでタバコを吸うことが影響するのは耳の感染症だけではないのは知っていましたか？[SEP]うん,4,False,case3.csv
わかりました。とにかくわかりました。[SEP]息子さんが何度も中耳炎を繰り返しているのは、あなたにとっても息子さんにとっても大きなストレスですね。タバコの煙が子どもの耳感染のリスクファクターの一つであるのを考慮すると、あなたが喫煙している環境が関連している可能性があります。息子さんの周りで吸わないように気をつけているというあなたの努力は理解していますが、それでもタバコの影響は考慮に入れなければならないかもしれません。[SEP],6,True,case3.csv
わかりました。とにかくわかりました。[SEP]息子さんが何度も中耳炎を繰り返している事は、あなたにとっても息子さんにとっても大きなストレスですね。タバコの煙が子どもの耳感染のリスクファクターの一つであるかを考慮すると、あなたが喫煙している事が関連している可能性があります。息子さんの周りで吸わないように気をつけているというあなたの努力は理解していますが、それでもタバコの影響は考慮に入れなければならないかもしれません。[SEP],6,True,case3.csv
わかりました。とにかくわかりました。[SEP]息子さんが何度も中耳炎を繰り返している状況は、あなたにとっても息子さんにとっても大きなストレスですね。タバコの煙が子どもの耳感染のリスクファクターの一つである点を考慮すると、あなたが喫煙しているのが関連している可能性があります。息子さんの周りで吸わないように気をつけているというあなたの努力は理解していますが、それでもタバコの影響は考慮に入れなければならないかもしれません。[SEP],6,True,case3.csv
わかりました。とにかくわかりました。[SEP]息子さんが何度も中耳炎を繰り返していることは、あなたにとっても息子さんにとっても大きなストレスですね。タバコの煙が子どもの耳感染のリスクファクターの一つであることを考慮すると、あなたが喫煙していることが関連している可能性があります。息子さんの周りで吸わないように気をつけているというあなたの努力は理解していますが、それでもタバコの影響は考慮に入れなければならないかもしれません。[SEP],6,False,case3.csv
"ええ,その通りです。[SEP]以前やめたときはどうやってできたのですか?[SEP]わかりません,今考えてみてもどのようにしたかすら覚えてないんです。でも,とにかくやったんです。私,想像できなかったの。タバコを吸う女性の赤ちゃんが死産になるとか,早産になるとか,また,障害児として生まれてくるなんてことを。だからもう飽き飽きするほど言われたでしよ。ね,もう今は危険な状態じゃないんです。",3,True,case4.csv
"ええ,その通りです。[SEP]以前やめたときはどうやってできたのですか?[SEP]わかりません,今考えてみてもどのようにしたかすら覚えてたんです。でも,とにかくやったんです。私,想像できなかったの。煙草を吸う女性の赤ちゃんが死産になるとか,早産になるとか,また,障害児として生まれてくるなんて事を。だからもう飽き飽きするほど言われたでしよ。ね,もう今は危険な状態じゃないんです。",3,True,case4.csv
"ええ,その通りです。[SEP]以前やめたときはどうやってできたのですか?[SEP]わかりません,今考えてみてもどのようにしたかすら覚えているんです。でも,とにかくやったんです。私,想像できなかったの。たばこを吸う女性の赤ちゃんが死産になるとか,早産になるとか,また,障害児として生まれてくるなんてのを。だからもう飽き飽きするほど言われたでしよ。ね,もう今は危険な状態じゃないんです。",3,True,case4.csv
ええ，その通りです。[SEP]以前やめたときはどうやってできたのですか？[SEP]わかりません，今考えてみてもどのようにしたかすら覚えてないんです。でも，とにかくやったんです。私，想像できなかったの。タバコを吸う女性の赤ちゃんが死産になるとか，早産になるとか，また，障害児として生まれてくるなんてことを。だからもう飽き飽きするほど言われたでしよ。ね，もう今は危険な状態じゃないんです。,3,False,case4.csv
そうですね。[SEP]薬を飛ばしてしまう事があっても困るのはあるんですね。[SEP]実は、あんまり効果を感じてないんですよね。,2,True,case9.csv
そうですね。[SEP]薬を飛ばしてしまう恐れがあっても困る人は無いんですね。[SEP]実は、あんまり効果を感じてないんですよね。,2,True,case9.csv
そうですね。[SEP]薬を飛ばしてしまう薬があっても困る事は少ないんですね。[SEP]実は、あんまり効果を感じてないんですよね。,2,True,case9.csv
そうですね。[SEP]薬を飛ばしてしまうことがあっても困ることはないんですね。[SEP]実は、あんまり効果を感じてないんですよね。,2,False,case9.csv
そう、それが分かっているもんだから、余計だというか、、、スイッチが入った瞬間からというか、また食べ過ぎてしまうんやろな~みないな。[SEP]食べ過ぎなければやめられるのに!っと思う。[SEP]それをやめたら、メシがうまくなったっていう話を聞いて、「これ!」って思って。,1,True,case8!.csv
そう、それが分かっているもんだから、余計すぎるというか、、、スイッチが入った瞬間、というか、また食べ過ぎてしまうんやろな~みないな。[SEP]食べ過ぎなければやめられるのに!っと思う。[SEP]これをやめたら、メシがうまくなったっていう話を聞いて、「これ!」って思って。,1,True,case8!.csv
そう、それが分かっているもんだから、余計なというか、、、スイッチが入った瞬間にというか、また食べ過ぎてしまうんやろな~みないな。[SEP]食べ過ぎなければやめられるのに!っと思う。[SEP]酒をやめたら、メシがうまくなったっていう話を聞いて、「これ!」って思って。,1,True,case8!.csv
そう、それが分かっているもんだから、余計怖いというか、、、スイッチが入った瞬間怖いというか、また食べ過ぎてしまうんやろな～みないな。[SEP]食べ過ぎなければやめられるのに！っと思う。　[SEP]タバコをやめたら、メシがうまくなったっていう話を聞いて、「これ！」って思って。,1,False,case8!.csv
そうですね、お願いしてもいいですか。[SEP]今日の朝はどうかした?遅れて来てたみたいだったけど。[SEP]いや、それが、特に何があったというわけではないんですが、間に合わなくて。,3,True,case7.csv
そうですね、お願いしても良いですか。[SEP]今日の朝はどうかした?遅れて来てたみたいだったけど。[SEP]いや、それが、特に何があったということではあるんですが、間に合わなくて。,3,True,case7.csv
そうですね、お願いしてもよいですか。[SEP]今日の朝はどうかした?遅れて来てたみたいだったけど。[SEP]いや、それが、特に何があったという意味では無いんですが、間に合わなくて。,3,True,case7.csv
そうですね、お願いしてもいいですか。[SEP]今日の朝はどうかした？遅れて来てたみたいだったけど。[SEP]いや、それが、特に何があったというわけでは無いんですが、間に合わなくて。,3,False,case7.csv
そう。ちょうど入社の時のことになった。[SEP]この体重が仕事をやめることで維持できないじゃないかという怖さがある。[SEP]そう。怖さ。ここからマックス90kgまでいったから。,2,True,case8!.csv
そう。ちょうど入社の時のようになった。[SEP]この体が野球をやめることで維持できないじゃないかという怖さがある。[SEP]そう。怖さ。ここからマックス90kgまでいったから。,2,True,case8!.csv
そう。ちょうど入社の時の話になった。[SEP]この気持ちがラグビーをやめることで維持できないじゃないかという怖さがある。[SEP]そう。怖さ。ここからマックス90kgまでいったから。,2,True,case8!.csv
そう。ちょうど入社の時の体重になった。[SEP]この体重がタバコをやめることで維持できないじゃないかという怖さがある。　[SEP]そう。怖さ。ここからマックス90㎏までいったから。,2,False,case8!.csv
そう。ご飯を普通に200に抑えていたのに、おかわり!!って、言って。[SEP]じゃぁ、食べ過ぎている傾向にあって、それを経験しているがゆえに、やっぱこう、それをやめちゃうと、増えちゃうかなって。[SEP]そう。」っていう。,2,True,case8!.csv
そう。ご飯を普通に200に抑えていたのに、おかわり!!って、言って。[SEP]じゃぁ、食べ過ぎている傾向にあって、それを経験しているがゆえに、やっぱこう、食事をやめちゃうとも増えちゃうかなって。[SEP]そう。』っていう。,2,True,case8!.csv
そう。ご飯を普通に200に抑えていたのに、おかわり!!って、言って。[SEP]じゃぁ、食べ過ぎている傾向にあって、それを経験しているがゆえに、やっぱこう、ご飯をやめちゃうとか増えちゃうかなって。[SEP]そう。ありがとうっていう。,2,True,case8!.csv
そう。ご飯を普通に200に抑えていたのに、おかわり！！って、言って。[SEP]じゃぁ、食べ過ぎている傾向にあって、それを経験しているがゆえに、やっぱこう、タバコをやめちゃうと体重増えちゃうかなって。　[SEP]そう。怖いっていう。,2,False,case8!.csv
"ええと,彼がお腹にいるときは,なんでも分け合っているわけだから,胎児に影響があるかもと分かっていたし,息子に何かがあったら生きていけようと思っていました。[SEP]でも今は何とかやっていけそうもないし,やってみようとすら思えないのですね。[SEP]ええ,その通りです。",2,True,case4.csv
"ええと,彼がお腹にいるときは,なんでも分け合っているわけだから,胎児に影響があるかもと分かっていたし,息子に何かがあったら生きていけると思っていました。[SEP]でも今は何とかやっていけそうもあるし,やってみようとすら思えたのですね。[SEP]ええ,その通りです。",2,True,case4.csv
"ええと,彼がお腹にいるときは,なんでも分け合っているわけだから,胎児に影響があるかもと分かっていたし,息子に何かがあったら生きていけないと思っていました。[SEP]でも今は何とかやっていけそうも無いし,やってみようとすら思えるのですね。[SEP]ええ,その通りです。",2,True,case4.csv
ええと，彼がお腹にいるときは，なんでも分け合っているわけだから，胎児に影響があるかもと分かっていたし，息子に何かがあったら生きていけないと思っていました。[SEP]でも今は何とかやっていけそうもないし，やってみようとすら思えないのですね。[SEP]ええ，その通りです。,2,False,case4.csv
はい。[SEP]それは、やっぱり、どっちかに決めておいた方がいいだろうということですよね。[SEP]そうですね。結局、どっちでもということだと、30分とか、場合によっては、やらなくてもいいかということになりがちだと思います。1人なら1分と決めた方が、その場を確保するために、準備できると思います。また、30分と決めれば、それくらいは絶対確保しようとおもえるだろうし。,2,True,case1.csv
はい。[SEP]それは、やっぱり、どっちかに決めておいた方がいいだろうということですよね。[SEP]そうですね。結局、どっちでもということだと、30分とか、場合によっては、やらなくてもいいかということになりがちだと思います。1回なら1日と決めた方が、その分を確保するために、準備できると思います。また、30分と決めれば、それくらいは絶対確保しようとおもえるだろうし。,2,True,case1.csv
はい。[SEP]それは、やっぱり、どっちかに決めておいた方がいいだろうということですよね。[SEP]そうですね。結局、どっちでもということだと、30分とか、場合によっては、やらなくてもいいかということになりがちだと思います。1日なら1人と決めた方が、そのスペースを確保するために、準備できると思います。また、30分と決めれば、それくらいは絶対確保しようとおもえるだろうし。,2,True,case1.csv
はい。[SEP]それは、やっぱり、どっちかに決めておいた方がいいだろうということですよね。[SEP]そうですね。結局、どっちでもということだと、30分とか、場合によっては、やらなくてもいいかということになりがちだと思います。1時間なら1時間と決めた方が、その時間を確保するために、準備できると思います。また、30分と決めれば、それくらいは絶対確保しようとおもえるだろうし。,2,False,case1.csv
そうですね。昼ましをたくさんかけたり、夜は早めに風呂に入るようにしたり...[SEP]色々工夫してくれてるみたいだね。ありがとう。それが効果を発揮してくれればってところだね。[SEP]そうですね。ただ、そうですよね。,5,True,case7.csv
そうですね。おましをたくさんかけたり、夜は早めに部屋に入るようにしたり...[SEP]色々工夫してくれてるみたいだね。ありがとう。それが効果を発揮してくれればってところだね。[SEP]そうですね。ただ、大変ですよね。,5,True,case7.csv
そうですね。朝ましをたくさんかけたり、夜は早めにトイレに入るようにしたり...[SEP]色々工夫してくれてるみたいだね。ありがとう。それが効果を発揮してくれればってところだね。[SEP]そうですね。ただ、不思議ですよね。,5,True,case7.csv
そうですね。目覚ましをたくさんかけたり、夜は早めに負担に入るようにしたり…[SEP]色々工夫してくれてるみたいだね。ありがとう。それが効果を発揮してくれればってところだね。[SEP]そうですね。ただ、難しいですよね。,5,False,case7.csv
ですね。まずはあれ(禁煙サポートプログラム)に申込んで許可をもらうところから始めてみようかなっと。[SEP]タバコをやめたいという意志があることが伺えます。しかし、タバコをやめることで体重が増加することに対する不安が大きいようですね。過去に禁煙に成功した経験から、食事の量が増えることを経験しているため、それが再び起こるかもしれないという心配があるようです。[SEP],6,True,case8!.csv
ですね。まずはあれ(禁煙サポートプログラム)に申込んでアドバイスをもらうところから始めてみようかなっと。[SEP]禁煙をやめたいという意志があることが伺えます。しかし、タバコをやめることで肥満が増加することに対する不安が大きいようですね。過去に禁煙に成功した経験から、食事の量が増えることを経験しているため、それが再び起こるかもしれないという心配があるようです。[SEP],6,True,case8!.csv
ですね。まずはあれ(禁煙サポートプログラム)に申込んでOKをもらうところから始めてみようかなっと。[SEP]たばこをやめたいという意志があることが伺えます。しかし、タバコをやめることで収入が増加することに対する不安が大きいようですね。過去に禁煙に成功した経験から、食事の量が増えることを経験しているため、それが再び起こるかもしれないという心配があるようです。[SEP],6,True,case8!.csv
ですね。まずはあれ(禁煙サポートプログラム)に申込んでパッチをもらうところから始めてみようかなっと。[SEP]タバコをやめたいという意志があることが伺えます。しかし、タバコをやめることで体重が増加することに対する不安が大きいようですね。過去に禁煙に成功した経験から、食事の量が増えることを経験しているため、それが再び起こるかもしれないという心配があるようです。[SEP],6,False,case8!.csv
そうですね。やっぱり、自分のために仕事は使うべきだという思いがあります。今の仕事は、それが嫌いなわけではないですが、自分が今やるべきことはそれではないと思います。自分の人生やキャリアの優先順位を上げるべきだと思います。[SEP]仕事は仕事で大事だけれど、今自分のために何が必要かということを考えると、それは、将来に向けたことを優先することだということですね。[SEP]はい。,1,True,case1.csv
そうですね。やっぱり、自分のために時間は使うべきだという思いがあります。今の仕事は、それが嫌いなわけではないですが、自分が今やるべきことはそれではないと思います。自分の人生やキャリアの優先順位を上げるべきだと思います。[SEP]仕事は仕事で大事だけれど、今自分のために何が必要かということを考えると、それは、未来に向けた努力を優先することだということですね。[SEP]はい。,1,True,case1.csv
そうですね。やっぱり、自分のために金は使うべきだという思いがあります。今の仕事は、それが嫌いなわけではないですが、自分が今やるべきことはそれではないと思います。自分の人生やキャリアの優先順位を上げるべきだと思います。[SEP]仕事は仕事で大事だけれど、今自分のために何が必要かということを考えると、それは、明日に向けた活動を優先することだということですね。[SEP]はい。,1,True,case1.csv
そうですね。やっぱり、自分のために時間は使うべきだという思いがあります。今の仕事は、それが嫌いなわけではないですが、自分が今やるべきことはそれではないと思います。自分の人生やキャリアの優先順位を上げるべきだと思います。[SEP]仕事は仕事で大事だけれど、今自分のために何が必要かということを考えると、それは、転職に向けた活動を優先することだということですね。[SEP]はい。,1,False,case1.csv
うぅん...たまたま起きるとか、そんなに緊張していなくても起きられるんですよね。[SEP]来られるときは、そうせずにも起きられるのか!それはいいね![SEP]そうなんですよ...逆に起きられない時は、寝るのがいいのかもしれません。,5,True,case7.csv
うぅん...たまたま起きるとか、そんなに意識していなくても起きられるんですよね。[SEP]来られるときは、心配せずにも起きられるのか!それはいいね![SEP]そうなんですよ...逆に起きられない時は、寝るのが難しいのかもしれません。,5,True,case7.csv
うぅん...たまたま起きるとか、そんなにしっかりしていなくても起きられるんですよね。[SEP]来られるときは、意識せずにも起きられるのか!それはいいね![SEP]そうなんですよ...逆に起きられない時は、寝るのが怖いのかもしれません。,5,True,case7.csv
うぅん．．．たまたま起きるとか、そんなに意識していなくても起きられるんですよね。[SEP]来られるときは、意識せずにも起きられるのか！それはいいね！[SEP]そうなんですよ…逆に起きられない時は、寝るのが遅いのかもしれません。,5,False,case7.csv
はい。せっかくなので、大胆に責任を取ってみようと思います。本当に、来年度も今の職場で働き続けるというのは、自分にとって良いことではないと思うので。[SEP]怠管理に関して少し困っているようですね。特に大きな問題があったわけではないけれど、朝の仕事に間に合わせることが難しかったということが理解できます。日常生活での小さな挑戦にも前向きに取り組んでいることは、とても良いことだと思います。[SEP]実際どうなるかはわからないですけどね。計画的に進められるといいとは思います。,5,True,case1.csv
はい。せっかくなので、大胆にコミュニケーションを取ってみようと思います。本当に、来年度も今の職場で働き続けるというのは、自分にとって良いことではないと思うので。[SEP]務管理に関して少し困っているようですね。特に大きな問題があったわけではないけれど、朝の時間に間に合わせることが難しかったということが理解できます。日常生活での小さな挑戦にも前向きに取り組んでいることは、とても良いことだと思います。[SEP]実際どうなるかはわからないですけどね。計画的に進められるといいとは思います。,5,True,case1.csv
